0215,Биогр.,Дейвид Фаунтин,Лорд Редсток и духовное пробуждение в России,"Книга об удивительном человеке и христианине, потомке известного древнего английского рода, внесшего огромный вклад в дело распространения Евангелия в дореволюционном Петербурге",,,
0216,Д и Н,Эвелин Кристенсон,Обретения через потери,"Откройте для себя, как смерть, разлука, развод, болезни, страдания и финансовые неудачи могут быть использованы Богом для того, чтобы сделать вас духовно богаче.",,,
0217,Ист.,В. Новомирова,Гиксосы,"Гиксосы - прозвище, которое дали египтяне потомкам Иосифа. Оно означает правители-пастухи. О них и пойдет речь в данной книге",,,
0218,Толк.,Р.Пакссон,Жизнь в Духе,Духовная жизнь Христианина,,,
0219,Д и Н,Томас Уатсон,Всё содействует ко благу,"Автор объясняет, что и радостный, и печальный опыт служит ко благу народа Божьего ",,,
0220,Д и Н,Ричард Л. Пратт,Пленяем всякое помышление,"Книга   учит отвечать на вопросы неверующих, ""Пленяя всякое помышление в послушание Христу"". Пратт показывает, как апологетика обусловлена учением Библии о человеке и его отношениях с Творцом.",,,
0221,Толк.,Рис Брайант,Крещение: что ты медлишь?,Взаимосвязь между крещением и обращением. Подлинный смысл крещения,,,
0222,Б и П,Ч. Х. Сперджен,Истинная пища и истинное питие,Проповеди Сперджена,Том 1,,
0223,Д и Н,"Дэвид Гудинг, Джон Леннокс",Ключевые понятия Библии,"Дается объяснение специальных терминов, используемых в Библии для определения основных понятий",,,
0224,Б и П,Ч. Х. Сперджен,Доказательство любви,Проповеди Сперджена,Том 2,,
0225,Б и П,Ч. Х. Сперджен,Ожидающая церковь,Проповеди Сперджена,Том 3,,
0226,Б и П,Ч. Х. Сперджен,Человекам это невозможно,Проповеди Сперджена,Том 4 ,,
0227,Д и Н,Ричард Пратт,Он дал нам прообразы,"Автор предлагает руководство для подготовки, исследования и применения ветхозаветных историй в современном мире",,,
0228,Б и П,Ч. Х. Сперджен,Возрастание в благодати,Проповеди Сперджена,Том 6 ,,
0229,Д и Н,Т. Лэйн и Пол Трипп,Как изменяются люди,"В этой книге четко разъясняется библейская модель перемен, которую вы можете применять в своей повседневной жизни.",,,
0230,Д и Н,Р. М. Макчин,Источники спасения,Проповеди и лекции шотландского проповедника Р. Макчина (1813-1843),,,
0231,Д и Н,Эрвин Люцер,Победа над смертью,"В этой книге вы найдете ответы на многие непростые вопросы, постигая славную истину о том, что благодаря Иисусу смерть умерла навсегда",,,
0232,Биогр.,Андреас Патц,Искренне ваш…,Интервью с известными в христианском мире людьми,,,
0233,Худ.,Джанет Оак,"Любовь растет, как дерево",История о потерях и обретениях; об умении преодолевать трудности и искусстве строить отношения; о стремлении человека к любви,,,
0234,Худ.,Джанет Оак,Любовь никогда не перестает,"История семьи Дэвис на западных землях Северной Америки, осваиваемых переселенцами в начале XIX в",,,
0235,Д и Н,Эрвин Люцер,"Кто ты, чтобы судить? ","Книга о том, как отличать библейское христианство от фальшивой духовности и ценностей сегодняшнего мира",,,
0236,Д и Н,Филип Янси,Молитва,Автор отвечает на непростой вопрос: способна ли молитва изменить жизнь?,,,
0237,Д и Н,Макс Лукадо,Он всё ещё двигает камни,"Бог готов сделать в нашей жизни то, на что мы сами не способны: отвалить тяжелый камень, за которым скрывается чудо.",,,
0238,Б и П,Ч. Х. Сперджен,Взгляд на Иисуса,Проповеди Сперджена,Том 5,,
0239,Биогр.,Эдвин и Лиллиан Харви,Они знали своего Бога,"В этом томе представлены биограф. повествования о Ф. и М. Генри, Ф. и К. Гарретсоне, Д.Госнере, лорде Рэдстоке и др.",Часть 4,,
0240,Худ.,Джанет Оак,У любви легкая поступь,"История семьи Дэвис на западных землях Северной Америки, осваиваемых переселенцами в начале XIX в",,,
0241,Худ.,Джанет Оак,"Любовь, созидающая дом","История семьи Дэвис на западных землях Северной Америки, осваиваемых переселенцами в начале XIX в",,,
0242,Биогр.,И. С. Проханов,В котле России,Автобиография с изложением главных фактов движения Евангельских христиан в России,,,
0243,Биогр.,Шерон Джеймс,Мое сердце в Его руках,Дерзновенное служение Энн Джадсон в Бирме.,,,
0244,М и Р,Мэтью Генри,Молодые христиане,"Ссылаясь на Послание ап. Павла к Титу, автор преподает уроки христианской жизни молодому поколению",,,
0245,Худ.,М.Е.R.,Мэри Джонс и ее Библия,"История о бедной девушке из Уэльса, которая босиком пеодолела 25 миль, чтобы купить Библию, на приобретение которой несколько лет копила деньги",,,
0246,Толк., Мартин Ллойд- Джонс ,Нагорная проповедь,,Том 1,,
0247,М и Р,"Джош Макдауэлл, Кевин Джонсон",Божья воля - это лучшее для твоей жизни,"Авторы объясняют, что Бог не только хочет, чтобы ты достиг целей, но у Него есть конкретный план, как это осуществить.",,,
0248,Толк.,Джон Ф. Мак-Артур младший,Толкование послания к Ефесянам ,,,,
0249,Д и Н,Ричард Стернс,Дыра в нашем евангелии,"Статус христианина требует не только личных взаимоотношений с Богом, но и влечет за собой публичные и преображающие взаимоотношения с этим миром",,,
0250,Ист.,Брат Андрей,Божий контрабандист,"История основателя миссии ""Открытые двери""",,,
0251,Д и Н,Эрвин Люцер,По обе стороны обиды: Преодолевая барьеры на пути к примирению,"На примерах  библейских героев автор показывает, как Бог смотрит на обидчика и его жертву",,,
0252,Д и Н,Алексей Прокопенко,Библейское покаяние. Псалом 50,На примере Псалма 50 рассматривается вопрос об истинном покаянии,,,
0253,Худ.,Джанет Оак,Расцветающая мечта любви,"История семьи Дэвис на западных землях Северной Америки, осваиваемых переселенцами в начале XIX в",,,
0254,Худ.,Джанет Оак,Вечное наследство любви,"История семьи Дэвис на западных землях Северной Америки, осваиваемых переселенцами в начале XIX в",,,
0255,Биогр.,Эрик Метаксас,Дитрих Бонхёффер. Праведник мира против Третьего Рейха,"Биография Бонхёффера, казненного на участие в заговоре против Гитлера",,,
0256,Ист.,Софья Ливен,Духовное пробуждение в России,,,,
0257,Д и Н,В. М. Журавлёв,"Велика верность Твоя, Господи",Свидетельства о чудных делах и благословениях Божьих,,,
0258,Ист.,Э. Ренанъ,Жизнь Иисуса,Историческое описание жизни Иисуса Христа,Старославянский язык,,
0259,Д и Н,Эдгар Эндрюс,Все из ничего. Креационизм и эволюция,Ответы на вопросы о теории эволюции с точки зрения науки и Библии,,,
0260,Ист.,,Как возникла Библия…,История возникновения Библии от глиняных табличек до современой печати.,,,
0261,М и Р,Гари Чепмен,Четыре сезона брака,"Книга помогает определить, в каком времени года вы живете, и дает практические советы по укреплению брака",,,
0262,Ист.,"А.В. Карев, К.В. Сомов",История христианства с I по XII век.,,,,
0263,М и Р,Джон Мак-Артур,Полноценная семья: Божий замысел для вашей семьи,"Книга поможет вам понять и исполнить свою роль в семье: роль мужа или жены, отца или матери.",,,
0264,Ист.,,История евангельских христиан-баптистов в СССР,"Возникновение и жизнь ЕХБ Церквей, национальные братства и деноминации союза ",,,
0265,Ист.,,Как возникла Библия…,История возникновения Библии от глиняных табличек до современой печати.,,,
0266,М и Р,Джон Пайпер,Этот преходящий брак,Книга раскрывает библейское учение о браке.,,,
0267,Худ.,Виталий Полозов,На круги своя,Сборник повестей и рассказов автора на христианские темы.,,,
0268,К и МР,Вольфганг Бюне,Игра с огнем,Исторический очерк  харизматического движения,,,
0269,Д и Н,Чарльз М. Шелдон,"По Его стопам, или Как поступил бы Иисус","Книга написана по мотивам проповедей и стала манифестом так называемого ""социального"" Евангелия.",,,
0270,М и Р,Харольд Дж. Сейла,Радость одиночества в окружении супружеских пар,"Книга рекомендована в качестве пособия по христианскому душепопечительству и  читателям, проявляющим интерес к теме безбрачия.",,,
0271,Биогр.,Иоанн Марк,История моей жизни,"Биография человека, посвятившего себя от ранней     юности до глубокой старости благовестию Евангелия. Он прошел через горнило Великих испытаний и остался верен своему Спасителю до последнего дыхания",,,
0272,Биогр.,Иоанн Марк,История моей жизни,"Биография человека, посвятившего себя от ранней     юности до глубокой старости благовестию Евангелия. Он прошел через горнило Великих испытаний и остался верен своему Спасителю до последнего дыхания",,,
0273,Биогр.,"Мерф-серф,    Джек Роланд Мерфи","Сокровище, взятое с собой в путь ","История собственной жизни на дне общества, написанное самим Мерфи. 21 год в тюрме особо строгого режима. История о том, как удалось там выжить - в обществе преступника,наркоманов и живых мертвецов",,,
0274,Биогр.,Стефан Фольке ,До дна,Алкоголь: судьбы людские,,,
0275,Биогр.,"Юлія Крюденер, Анна Ліон",Євангелист Іван Онищенко,Биография першого баптиста на Україні,,,
0276,Биогр.,Ширинай Досова,Моя вечная весна,"Жизнь и служение миссионерки - женщины, родившийся в мусульманской семье и выросшей в Средней Азии, которая приняла Христа и смело благоветсвует на Арбате и вокзалах Москвы",,,
0277,Д и Н,Михаил и Надежда Телеповы,Есть только миг,Размышления над книгой Екклесиаста в контексте современной жизни,,,
0278,Биогр.,Джон Уэсли,Первые плоды Духа,Краткая биография. Три проповеди,,,
0279,Биогр.,Пастор Ричард Вурмбранд,Страждання за Христа,Неймовірні страждання пастора протягом 14 років у румунській в'язниці за часів комуністичного режиму,,,
0280,Биогр.,"Издательство ""Lebensquelle"" e.V.",День спасения,Сборник свидетельств об обращении к Богу,,,
0281,Биогр.,Вера Шельпякова,"Не бойся, только веруй!",О жизни волжских молокан в конце прошлого столетия,Том 1,,
0282,Биогр.,Артур Катц,Взятый Богом в удел,Дневник еврейского атеиста,,,
0283,Д и Н,Джош Макдауэлл,Код да Винчи: поиск ответов,"Где факты, а где вымысел в книге Дэна Брауна ""Код да Винчи"". Автор предоставляет блестящие доказательства и компетентно отделяет факты от заблуждений, предлагая неоспоримые истины, которым можно доверять.",,,
0284,Д и Н,Рик Уоррен,Целеустремленная жизнь,"Книга поможет вам узнать ради чего вы живете, и увидеть удивительный Божий замысел для вашей жизни. Рик Уоррен приглашает вас в сорокадневное духовное путешествие, которое поможет вам найти истинный ответ на самый важный вопрос:""Зачем я здесь?"" ",,,
0285,Д и Н,Рик Уоррен,Целеустремленная жизнь,"Книга помжет вам узнать ради чего вы живете, и увидеть удивительный Божий замысел для вашей жизни. Рик Уоррен приглашает вас в сорокадневное духовное путешествие, которое поможет вам найти истинный ответ на самый важный вопрос:""Зачем я здесь?"" ",,,
286,Д и Н,Чарльз Стэнли,Источник моей силы.,"Эта книга предлагает надежду тем, кто пал духом и тащит за собой по жизни бремя эмоций. Автор излагает библлейские принципы, которые помогут вам: -победить боль, незащищенность, одиночество и отчуждение  -противостоять болезненным воспоминаниям прошлого -понять каким образом бремя эмоций ограничивает и определяет принимаемые нами решения и др.",,,
0287,Б и П,С примечаниями доктора П.М. Мастерса,Баптистское вероисповедание 1689 г.,"Тридцать две статьи христианской веры и практики. Документ, который является обобщением того,во что мы верим.",,,
0288,Толк.,Чарльз Бриджес,Толкование Книги Притч Соломона,Руководство для мудрого поведения во всех человеческих взаимоотношениях,,,
0289,Ист.,С.В. Санников,Готовимся к крещению,"Беседы для тех, кто собирается принять крещение. Они дают общее представление об основах веры и учат практической христианской жизни",,,
0290,Д и Н,Ларри Беркетт,Жизнь без долгов,Как выбраться из долгов и больше не попадать в них,,,
0291,Б и П,Джош Макдауелл,Свидетельство достоверности Библии,"В книге рассказывается о новых археологических открытиях и приводятся свидетельства истинности христианства, обнаруженные за последние двадцать лет.",,,
0292,М и Р,Марк Дрисколл,Порнообращенный христианин,Откровенный разговор о порнографии и мастурбации,,,
0293,Д и Н,А.Б.Симпсон,Ключ к молитве,"Изложение основ христианской молитвы (молитва Господня, молитва веры, препятствия в молитве).",,,
0294,Д и Н,А.Б.Симпсон,Четыре грани Евангелия,"Четыре ведущие мысли, объединяющие все благословения, предлагаемые нам Христом. Христос - наш Спаситель, Освятитель, Исцелитель, грядущий Царь. ",,,
0295,Б и П,Рене Паш,Второе пришествие Иисуса Христа,"Исследования пророчеств о грядущих событиях. Восхищение Церкви, бедствия, грядущие на всю вселенную, востановление Израиля, период тысячелетнего Царства, окончательный суд над народами.",,,
0296,Д и Н,"Дж. С. Маклин, Роджер Окленд, Ларри Маклин.",Очевидность сотворения мира. Происхождение планеты Земля.,"На основе данных палеонтологии, геологии, археологии, биологии, астрономии и др. наук показана научная, историческая и пророческая точность библейских текстов.",,,
0297,К и МР,Марвин Кован,В ответ на заявление мормонов.,"Основные утверждения мормонов в свете исторических документов, научных фактов, Библии и основопологающих мормонских источников.",,,
0298,К и МР,К. Харинк ,Харизматическое движенин,"От Бога ли пятидесятническое и харизматическое движение. Что такое крещение Святым Духом, пророческий дар и дар языков, каково их значение в церкви.",,,
0299,К и МР,Бенедикт Петерс,"Знамения, чудеса и собрание сочинений о молитве.","Значения знамений и чудес в прошлом, настоящем и будущем. Всегда ли Бог слышит наши молитвы.",,,
0300,Д и Н,Грег Лукас,"Борьба с ангелом: Рассказ о любви, тяжелом недуге и уроках благодати","Автор делится своей историей воспитания сына-инвалида и уроками, преподанными ему благодатью Бога.",,,
0301,Д и Н,Джон Оуэн,Святой Дух ,"Цель автора - опровержение представления, что каждый, кто захочет, может жить христианской жизнью, а также исследование влияния истины на совесть, измененную Божьей благодатью и испытанную Словом Божьим",,,
0302,Худ.,Наталья Гурмеза,Купи мне маму,Сборник рассказов,,,
0303,Д и Н,Джерри Бриджес,Терпимые грехи,"Автор рассматривает грехи, которые стали ""допустимыми"" и потому привычными в жизни верующих ",,,
0304,Б и П,Джош Мак-Дауэлл,Не просто плотник,Научные доказательства христианских доктрин ,,,
0305,Д и Н,Каролин Махейни,Обаяние женственности,"Автор показывает, что с проблемами можно справиться при помощи Божьего Слова",,,
0306,Б и П,Клайв С. Льюис,Просто христианство. Бог под судом,"Христианское поведение. Во что верят христиане? Добро и зло, как ключ к пониманию Вселенной. Христианство и культура",,,
0307,Худ.,Джанет Оак,Любовь набирает силу,"История семьи Дэвис на западных землях Северной Америки, осваиваемых переселенцами в начале XIX в",,,
0308,Худ.,Джанет Оак,Любовь приходит домой,"История семьи Дэвис на западных землях Северной Америки, осваиваемых переселенцами в начале XIX в",,,
0309,Д и Н,Макс Лукадо,Божья повесть - твоя повесть,"Автор наглядно показывает, как полотно нашей судьбы пересекается с Божьим Словом",,,
0310,Д и Н,Мартин Лютер,Рождены рабами,,,,
0311,Д и Н,"Билл Хайбелс, Марк Миттельберг","""Заразительное"" христианство",,,,
