0312,М и Р,Джон Мак-Артур,Хранимые в Божьих руках. Что говорит Библия о смерти детей?,"Книга принесет утешение тем, кто испытывает самую горькую утрату",,,
0313,Б и П,Генри Моррис,Сотворение мира: научный подход,Научные доказательства теории сотворения мира ,,,
0314,Д и Н,Джон Мак-Артур,Найдена: Божья воля,Шесть принципов познания Божьей воли,,,
0315,Б и П,Платон Харчлаа,Библия и наука ,Бог и творение во свете Библии и науки,Апологетический сборник,,
0316,Д и Н,Джей Адамс,"Прощены, чтобы прощать","Автор рассматривает, что говорит Библия о прощении и как это применяется на практике",,,
0317,Б и П,Джеймс Пакер,Познать Бога,Изучение характера и природы Бога,,,
0318,Д и Н,Джерри Бриджес,Евангелие для настоящей жизни,"Ключ к решению наших проблем - в большей полное уразуметь удивительное дело Христово, совершенное на кресте",,,
0319,Д и Н,Джерри Бриджес,Евангелие для настоящей жизни,"Ключ к решению наших проблем - в большей полное уразуметь удивительное дело Христово, совершенное на кресте",,,
0320,Д и Н,Вильгельм Буш,Иисус - наша судьба,"Благовестие для людей, проповедь Евангелия",,,
0321,Д и Н,Филип Янси,"Почему? Вопрос, который остается всегда","Книга обращается к тем, кто несет бремя страданий, чья вера пошатнулась, кто испытал разочарование, но пытается найти смысл в том, что происходит",,,
0322,Б и П,Вернер Бергманн,Жертвы ,Какой духовный смысл вкладывал Господь в выполняемые видимые действия службы жертв и ветхозаветных праздников,,,
0323,Худ.,Андрей Везиков,Молодо-зелено,"Повесть адресована прежде всего подросткам. Опора в жизни - истина, возвещенная в Евангелии",,,
0324,Худ.,Андрей Везиков,Молодо-зелено 2,"Повесть адресована прежде всего подросткам. Опора в жизни - истина, возвещенная в Евангелии",,,
0325,Худ.,Андрей Везиков,Молодо-зелено 3,"Повесть адресована прежде всего подросткам. Опора в жизни - истина, возвещенная в Евангелии",,,
0326,Худ.,Андрей Везиков,Молодо-зелено 4,"Повесть адресована прежде всего подросткам. Опора в жизни - истина, возвещенная в Евангелии",,,
0327,Б и П,Клайв С. Льюис,Просто христианство,"Христианское поведение. Во что верят христиане? Добро и зло, как ключ к пониманию Вселенной. Христианство и культура",,,
0328,Б и П,Клайв С. Льюис,Просто христианство,"Христианское поведение. Во что верят христиане? Добро и зло, как ключ к пониманию Вселенной. Христианство и культура",,,
0329,Д и Н,Пол Трипп,Орудия благодати в руках Искупителя,"Следуя примеру Иисуса Христа, автор объясняет нам, что означает хорошо знать человека и как мы должны возглашать истину с любовью",,,
0330,Д и Н,Алексей Коломийцев,Драгоценный Христос,"Как бы много вы ни знали о Боге и о религии, эта книга навсегда перевернет ваше представление о Христе и о том, что Он сделал для вас",,,
0331,Биогр.,Ян Ауке Брандсма,Менно Симонс из Витмарзума,Биография реформатора 16-го столетия,,,
0332,Б и П,Джим Петерсен,Евангелизм как образ жизни,Новый взгляд на традиционную евангелизацию,,,
0333,М и Р,Джон Пейсти,Чтобы семья была крепкой,"Данную книгу характеризуют широкий диапазон тем, конкретность, откровенность, удивительное сочетание глубины содержания и простоты изложения основных библейских принципов",,,
0334,Д и Н,Мартин Ллойд-Джонс,Духовная депрессия,Причины возникновения депрессии и способы избавления от нее,,,
0335,Д и Н,Грегори Р. Фриззелл,Как развивать эффективную молитвенную жизнь,"Вы познакомитесь со всеми элементами молитвы, которая будет развивать ваши отношения с Богом и наполнять вас силой",,,
0336,Д и Н,Фрэнсис Шеффер,"Он здесь, и Он не молчит","В книге рассматриваются проблемы, порожденные нехристианскими представлениями человека о мире о самом себе",,,
0337,М и Род,Эвелин Кристенсон,"Что происходит, когда женщины молятся","Условие получения Божьего ответа на нашу просьбу, содержание молитвы, ее результаты и развитие молитвенного служения.",,,
0338,Худ.,Герман Гартфельд,Ирина,"Захватывающая история о людях, живущих радостью и печалью, о триумфе и гонениях, героизме и жертвенности. ",,,
0339,Худ.,Анатолий Власов,Разные разности,"Наряду со стремлением к небесному не остается без внимания и окружающее земное, но что у автора свои взгляды",,,
0340,М и Род,Джеймс Добсон,Любовь на всю жизнь,"Реальная семейная жизнь порой сильно отличается от наших мечтаний. В это время важно помнить, что Богу под силу сохранить наше семейное счастье на всю жизнь",,,
0341,Худ.,Николай Рахуба,Хранимый Божьей милостью,"Книга рассказывает о действии Бога в жизни юноши, попавшего в сложные ситуации военного времени.",,,
0342, Б и П,Эрих Зауер,На заре искупления мира,Основы библейского откровения,,,
0343,Д и Н,Джон Пайпер,Зло торжествует и проигрывает,"Книга о том, как Бог использует зло в достижении победы над злом",,,
0344,Б и П,Чарльз Сперджен,12 проповедей об освящении,Проповеди знаменитого проповедника,,,
0345,Д и Н,Пол Бенвер,Как понимать пророчества о конце времен: Комплексный подход,"В книге рассматриваются противоречивые мнения, связанные с темой пророчества, приводятся библейские данные",,,
0346,Б и П,Иаков Козлов,Вопросы и ответы,"Ответы на вопросы, взятые из писем радиослушателей - как грех вошёл в мир, что такое искушение, какое значение имеет молитва в жизни Христиан",,,
0347,Д и Н,Пол Дэвид Трипп,Опасное призвание,Автор предлагает четкую стратегию в важнейшей борьбе за здоровье церкви,,,
0348,Б и П,Вильгельм Буш,Приди домой,Проповедь о блудном сыне,,,
0349,Худ.,"Издательство ""GBV""",Дорога ввысь,"""На службе великого герцога"", ""Победа веры"".",Том 8,,
0350,Худ.,"Издательство ""GBV""",Дорога ввысь,"""Кораблекрушение"", ""Все-с Богом!"", ""Прости нам грехи наши"", ""Сын художника"", ""Мир после вражды"".",Том 9,,
0351,К и МР,А.Зайбель,Сладостное обольщение церкви,попытки исцеления основанные не на Библии,,,
0352,Худ.,"Издательство ""GBV""",Дорога ввысь,"""Свет во мраке"", ""Опасность Закройте шлюз!"", ""Солнышко на хуторе"".     ",Том 10,,
0353,Ист.,Н.И.Салов-Астахов,палаточная миссия,исторический очерк начала 20-го века,,,
0354,Д и Н,Ли Стробел,Христос под следствием,журналистское расследование дела Христа,,,
0355,Худ.,"Издательство ""GBV""",Дорога ввысь,"""Ради венца"", ""Возвращение на родину"", ""Потерянная банкнота"".",Том 11,,
0356,Худ.,"Издательство ""GBV""",Дорога ввысь,"""Песочные часы"", ""Близнецы из Веттерхофа"".",Том 12,,
0357,Худ.,"Издательство ""GBV""",Дорога ввысь,"""Царская дочь"", ""Пастушок"".",Том 13,,
0358,Худ.,"Издательство ""GBV""",Дорога ввысь,"""Совиное гнездо"", ""Бродячие певцы"".",Том 14,,
0359,Худ.,"Издательство ""GBV""",Дорога ввысь,"""Певунья доктора Лютера"", ""Деревенский учитель"", ""За веру и отечество"".",Том 15,,
0360,Д и Н,Джон Кросс,Путник на дороге в Эммаус,"Книга расскрывает основное содержание Библии. Автор выстраивает библейские события в едином повествовании, рассматривая их с точки зрения людей, которые были действующими лицами или непосредственными свидетелями истории",,,
0361,Б и П,Рене Паш,Святой Дух. Его сущность и действие.,Библейское учение о Духе Святом.,,,
0362,Б и П,Чарльз Райри,Основы богословия,Разумное истолкование христианской веры. Изложение истины о Боге на основании Слова Божьего.,,,
0363,М и Род,Джон Пейсти,Чтобы семья была крепкой,"Данную книгу характеризуют широкий диапазон тем, конкретность, откровенность, удивительное сочетание глубины содержания и простоты изложения основных библейских принципов",,,
0364,Д и Н,Анна Грэм-Лотц,Видение Его славы,"Книга дает ответы на вопросы: -Есть ли надежда на будущее, когда жизнь неимоверно тяжела чтобы выносить ее…                           -Когда с хорошими людьми случаются плохие вещи; -Когда сатана одерживает верх; -Когда все выходит из-под контроля                                           ",,,
0365,Д и Н,Билл Брайт,Передаваемые понятия,"Как испытать Божью любовь и прощение, как стать плодотворным свидетелем, как любить верой, как испытать радость от пожертвования и др.",,,
0366,Худ.,Евгения Кобзарь,"Искры, летящие вверх.","Повести. Истории о вере людей, побеждающей самые тяжелые обстоятельства. Свидетельства о том, как действует Бог в жизнях людей, преданных Ему.",,,
0367,Ист.,Володимир Домашовець,Український євангельсько-баптистський рух в його 150-річний ювілей.,Історія Баптистського Руху за період 1852 - 2002 років.,,,
0368,Б и П,Роберт Т. Бойд,Курганы. Гробницы. Сокровища.,Иллюстрированное введение в библейскую археологию.,,,
0369,М и Род,Эвелин Кристенсон,"Что происходит, когда женщины молятся.","Условие получения Божьего ответа на нашу просьбу, содержание молитвы, ее результаты и развитие молитвенного служения.",,,
0370,Д и Н,Рон Путнам ,Путь к восстановлению,"Что значит жить духовной жизнью и как это сделать. Осознание необходимости в Боге, познание Бога",,,
0371,Худ.,"Издательство ""GBV""",Дорога ввысь,"""Швея из Щецина"",""Дубок"".                                               Швея была между знакомыми ей людьми, как свеча от которой зажигали свои тлеющие фитили уставшие сердца.                                                 Прекрасное дерево помоло нищему мальчику найти свою семью ",Том 16,,
0372,Худ.,Павел Сильчев,Цена спокойной жизни,"Творческий дебют молодого автора. Рассказ содержит частичку его биографии, его размышлений над жизнью, его опыта становления как личности.",,,
0373,Худ.,Линда Чайкин,Акушерка из Санкт-Петербурга,"Насышенная историческими деталями история о любви, опасности и Божьей верности",,,
0374,Худ.,Герман Гартфельд,Любовь сильнее красного террора,"История девушки, бесстрашного лидера ЕХБ в России. Чрезвычайно необходимые сведения про самую последнюю и наиболее тонкую стратегию коммунистов  по уничтожению христианства.",,,
0375,Худ.,Вальтер Шнайдер,Кто сильнее,Рассказ о молодых миссионерах с Лабрадора.,,,
0376,Худ.,Кристина Рой,В изгнании,"Анна, находясь в изгнании, попадает на работу к мельнику. Несет благую весть для всего села Зарошья и раскрывает тайну помошника мельника.",,,
0377,Худ.,К.М. Стром,Джон Ньютон: Свирепый моряк,"Книга о том, как Бог спас человека, занимающегося работорговлей",,,
0378,Худ.,Мирна Грант,Ваня,Документальная повесть о гибели в армии бывшего Советского Союза верующего солдата Ивана Моисеева.,,,
0379,Д и Н,Чарлз Стенли,Страдания во благо,"Автор показывает, что Бог сокрушает нас, допуская трудные времена, чтобы привести нас к духовной зрелости, более тесному общению с Собой, более эффективному служению",,,
0380,Д и Н,Чарльз Стенли,Как преодолевать трудности,"Если вы дитя Бога, чье сердце жаждет увидеть, как Бог прославляется через вашу жизнь, - трудности не сокрушат вас",,,
0381,Д и Н,Чарльз Стэнли,Дар любви,"Книга будет способствовать тому, чтобы Божья любовь в полной мере засияла в ваших сердцах",,,
0382,Биогр.,Тасс Саада,Снайпер Арафата,"Книга палестинского беженца, члена ООП, который перешел в христианство",,,
0383,М и Р,Джон Ортберг,Несовершенные люди,"Прочитав книгу, вы обретете мудрость и средства сближения с людьми ",,,
0384,Д и Н,Жан Кальвин,Наставление в христианской вере. Том 1-2,,,,
0385,Д и Н,Жан Кальвин,Наставление в христианской вере. Том 3,,,,
0386,Биогр.,Владимир Марцинковский,Записки верующего.," В биографическом очерке рассказывается о тяготах и испытаниях, выпавших на долю верующих в послереволюционной России, трагических событиях на долго определивших ход истории нашей страны.",,,
0387,Биогр.,Ф.К.Бейли,Молодой бунтарь в Бристоле,Биография Джорджа Мюллера.,,,
0388,Биогр.,"Серия книг ""Зов веры""",Великий труженик.,Повесть о Джоне Уэсли - основателе методистской церкви в Англии.,,,
389,Биогр.,"Серия книг ""Зов веры""",В краю тайфунов,"Повесть о миссионере - Джоне Пейтоне. Из Шотландии он отправился на острова Новые Гебриды, где работал, подвергая опасности свою жизнь, и был великим глашатаем христианской веры.",,,
390,Д и Н,Жан Кальвин,Наставление в христианской вере. Том 4,,,,
391,Д и Н,Освальд И. Смит,Бог - наше спасение,Спасение - это дар Божий и человек может получить его только через веру во Христа,,,
392,Д и Н,Сьюзан Хант,Духовное материнство,"Основы женского служения.Какой может быть Церковь и какой она должна быть в действительности. Полное посвящение себя людям, а не программам.",,,
393,М и Род,Линда Диллоу,Созидающее партнерство,"Апологетика христианского брака. Практические советы для тех женщин, которые независимо от своего культурного уровня хотят быть просто женами по образцу, данному в Священном Писании.",,,
394,Б и П,Яков Левен,Сеется семя,Тысяча ярких примеров из жизни помогающих составить проповедь.,,,
395,Д и Н,Макс Лукадо,"Любовь, которую стоит отдавать","Трудно любить людей, нарушающих обеты и грешащих против истины. Гребущих деньги и готовых ударить нас в спину. С которыми мы встречаемся и вступаем в брак. Как мы можем любить того, кого любить так трудно? На примере 1 Коринфянам 13 автор разъясняет свойства любви.",,,
396,Биогр.,Джон Пайпер,Верные Богу. Том 1,"Торжество Божьей благодати в жизни Августина, Лютера и Кальвина",Том 1,,
397,Биогр.,Джон Пайпер,Верные Богу. Том 2,"Плод страданий в жизни Джона Буньяна, Вильяма Купера, Дэвида Брейнерда",Том 2,,
398,Биогр.,Джон Пайпер,Верные Богу. Том 3,"Непоколебимое основание - Несокрушимое упорство в жизни Джона Ньютона, Чарльза Симеона и Уильяма Уилберфорса",Том 3,,
399,Биогр.,Джон Пайпер,Верные Богу. Том 4,"Борьба за истину - Защита правды и ценности Христа в жизни Афанасия, Джона Оуэна и Дж. Мейчена",Том 4,,
400,Биогр.,Джон Пайпер,Верные Богу. Том 5,"Восполнение скорбей Христовых. Цена проповеди Евангелия в жизни Уильяма Тиндейла, Адонирама Джадсона и Джона Патона",Том 5,,
401,Д и Н,Чарльз Стэнли,Как обрести надежду,Как в трудных обстоятельствах жизни сохранить живую надежду и последовательную верность Христу.,,,
0402,Биогр.,Гюнтер Виске.     Генрих Левен мл.  ,Они следовали за Иисусом,"Девять ярких биографий из полувековой истории Церкви. Живя в разное историческое время, в разных условиях, они сохранили верность открытому им евангельскому учению.",,,
0403,Д и Н,Билли Грэм,Мир с Богом,Книга дает ясные и исчерпывающие ответы на самые насущные жизненные вопросы каждого человека,,,
0404,Д и Н,Пол Трипп,Война слов,"Истоки и решение проблем общения. Какой силой и каким влиянием могут обладать слова, каким прекрасным даром и благословением они могут быть, а также какую опасность они могут таить в себе. Книга научит сначала думать, а потом говорить.",,,
0405,М и Род,Дафни Керк,Воссоединение поколений,"Практические способы как изменить нашу жизнь и жизнь окружающих, и решить проблему ""отцов и детей"" как в церковной, так и в повседневной жизни",,,
0406,дух,Айвен Х.  Френч,Принципы и практика молитвы,,,,
0407,Худ.,Виталий Полозов,Прощеный хлеб,Сборник повестей и рассказов,,,
